{
  "schema_version": 2,
  "skill_version": "2.6.0",
  "audit_id": "fixture-layer-split",
  "generated_at": "2026-07-31T00:00:00Z",
  "by_category": {"http": 1},
  "flags_summary": {},
  "surfaces": [
    {
      "id": "reports:http:export",
      "partition": "reports",
      "category": "http",
      "method": "GET",
      "path": "/api/v1/reports/export",
      "registration_file": "server/api/v1/reports/export.get.ts",
      "handler_file": "server/api/v1/reports/export.get.ts",
      "line_range": [1, 80],
      "handler_hash": null,
      "auth_required": true,
      "auth_middleware": ["requireRole"],
      "roles_required": ["reporting"],
      "params": [],
      "trust_zone": "internal",
      "data_ops": ["read"],
      "framework": "Nitro",
      "serves_resource": "Report",
      "intended_gate": "requireRole('reporting') + tenant ownership",
      "emits_bytes": true,
      "guarded_paths": [
        {"branch_id": "authorized", "condition": "role check passes", "enforced_gate": "requireRole('reporting') + tenant ownership", "serves_bytes": true}
      ]
    }
  ]
}
