{
  "schema_version": 2,
  "skill_version": "2.4.0",
  "audit_id": "fixture-deck-bug",
  "generated_at": "2026-06-19T00:00:00Z",
  "by_category": {"http": 1},
  "flags_summary": {},
  "surfaces": [
    {
      "id": "deck:http:resolver",
      "partition": "deck",
      "category": "http",
      "method": "GET",
      "path": "/s/{shortId}",
      "registration_file": "server/api/s/[shortId].get.ts",
      "handler_file": "server/api/s/[shortId].get.ts",
      "line_range": [1, 60],
      "handler_hash": null,
      "auth_required": true,
      "auth_middleware": ["verify __sv_ cookie", "hasValidVerification"],
      "roles_required": [],
      "params": [{"name": "shortId", "source": "path", "sensitive": false}],
      "trust_zone": "public",
      "data_ops": ["read"],
      "framework": "Nuxt",
      "serves_resource": "Deck",
      "intended_gate": "2FA email verification + allowed-email/domain list",
      "emits_bytes": false,
      "guarded_paths": [
        {"branch_id": "verified", "condition": "valid __sv_ cookie", "enforced_gate": "2FA verification + allow-list", "serves_bytes": false}
      ]
    }
  ]
}
