{
  "schema_version": 2,
  "skill_version": "2.6.0",
  "audit_id": "fixture-recall-floor",
  "generated_at": "2026-07-31T00:00:00Z",
  "by_category": {"cli_admin": 1},
  "flags_summary": {},
  "surfaces": [
    {
      "id": "plugin:cli:enroll-resolve",
      "partition": "plugin",
      "category": "cli_admin",
      "method": null,
      "path": "otlp-forwarder --enroll",
      "registration_file": "plugin/scripts/otlp-forwarder.mjs",
      "handler_file": "plugin/scripts/otlp-forwarder.mjs",
      "line_range": [60, 110],
      "handler_hash": null,
      "auth_required": true,
      "auth_middleware": ["requireEnrolmentToken"],
      "roles_required": [],
      "params": [],
      "trust_zone": "internal",
      "data_ops": ["read"],
      "framework": "node",
      "serves_resource": "OtlpSpan",
      "intended_gate": "operator enrolment token + org scope check before the relay will resolve a stream",
      "emits_bytes": false,
      "guarded_paths": [
        {"branch_id": "enrolled", "condition": "valid enrolment token", "enforced_gate": "operator enrolment token + org scope check", "serves_bytes": false}
      ]
    }
  ]
}
